{"dataset_id":"pytorch_v0.7_boundary_factory","registries":{"environments":"environments/registry.json","sources":"sources/registry.json"},"status":"verified","tasks":[{"admission_evidence":"tasks/pytorch/117065_index_copy_zero_dim/admission/evidence.json","admission_status":"verified","environment_status":"ready","replay_status":"verified","runtime_tier":"cpu_python_overlay","source_status":"ready","task_id":"pytorch__117065__index_copy_zero_dim","task_path":"tasks/pytorch/117065_index_copy_zero_dim"},{"admission_evidence":"tasks/pytorch/118762_weight_norm_default_dim/admission/evidence.json","admission_status":"verified","environment_status":"ready","replay_status":"verified","runtime_tier":"cpu_python_overlay","source_status":"ready","task_id":"pytorch__118762__weight_norm_default_dim","task_path":"tasks/pytorch/118762_weight_norm_default_dim"},{"admission_evidence":"tasks/pytorch/126461_cummin_rank_zero/admission/evidence.json","admission_status":"verified","environment_status":"ready","replay_status":"verified","runtime_tier":"cpu_python_overlay","source_status":"ready","task_id":"pytorch__126461__cummin_rank_zero","task_path":"tasks/pytorch/126461_cummin_rank_zero"},{"admission_evidence":"tasks/pytorch/139751_triton_ygrid_mask/admission/evidence.json","admission_status":"verified","environment_status":"ready","replay_status":"verified","runtime_tier":"cuda_python_overlay","source_status":"ready","task_id":"pytorch__139751__triton_ygrid_mask","task_path":"tasks/pytorch/139751_triton_ygrid_mask"},{"admission_evidence":"tasks/pytorch/143792_addmv_empty_matrix/admission/evidence.json","admission_status":"verified","environment_status":"ready","replay_status":"verified","runtime_tier":"cpu_source_snapshot_fuller","source_status":"ready","task_id":"pytorch__143792__addmv_empty_matrix","task_path":"tasks/pytorch/143792_addmv_empty_matrix"},{"admission_evidence":"tasks/pytorch/147352_storage_offset_overflow/admission/evidence.json","admission_status":"verified","environment_status":"ready","replay_status":"verified","runtime_tier":"cpu_source_snapshot_fuller","source_status":"ready","task_id":"pytorch__147352__storage_offset_overflow","task_path":"tasks/pytorch/147352_storage_offset_overflow"}],"version":"v0.7"}